jobUrl,datePosted,jobTitle,skills,industry,industryAddressCountry,industryAddressLocality,industryAddressRegion,industryStreetAddress,employmentType,hiringOrganizationName,hiringOrganizationUrl,jobDescription
https://hk.linkedin.com/jobs/view/asia-pacific-graduate-program-at-the-est%C3%A9e-lauder-companies-inc-2779243409?refId=HpRt87Bhlo2CrHkclqZF%2Bg%3D%3D&trackingId=FJRUz0W%2BjzNqvcaCW1WdWQ%3D%3D&position=2&pageNum=0&trk=public_jobs_jserp-result_search-card,2021-10-05T01:53:19.000Z,Asia-Pacific Graduate Program,,"Consumer Goods,Cosmetics",HK,Hong Kong,,,FULL_TIME,The Estée Lauder Companies Inc.,https://www.linkedin.com/company/the-estee-lauder-companies-inc,"&lt;strong&gt;Start your exciting career journey here&lt;br&gt;&lt;br&gt;&lt;/strong&gt;The Estée Lauder Companies offers unique development programs especially designed for undergraduate students. If you are a results-driven digital native with a passion for luxury beauty, The Estée Lauder Companies could be a valuable first step in your career journey.&lt;br&gt;&lt;br&gt;We seek high-performers from all university levels to bring fresh perspectives to our teams. Our talent management team works diligently to set our interns and full-time professionals up for success. Business leaders are assigned to help students define business goals, develop their skillset, and guide them to make an impact from day one.&lt;br&gt;&lt;br&gt;&lt;strong&gt;&lt;u&gt;What You Will Achieve&lt;br&gt;&lt;/u&gt;&lt;/strong&gt;&lt;ul&gt;&lt;li&gt; Invaluable exposure to the prestige beauty industry&lt;/li&gt;&lt;li&gt; Access to mentoring, coaching, learning and development opportunities&lt;/li&gt;&lt;li&gt; Building leadership skills&lt;/li&gt;&lt;li&gt; Gaining business insights and expanding capabilities to accelerate career development&lt;br&gt;&lt;/li&gt;&lt;/ul&gt;&lt;strong&gt;&lt;u&gt;Qualifications&lt;br&gt;&lt;br&gt;&lt;/u&gt;&lt;/strong&gt;&lt;strong&gt;What we are looking for &lt;br&gt;&lt;/strong&gt;&lt;ul&gt;&lt;li&gt; Penultimate or final year students in any discipline with outstanding academic records&lt;/li&gt;&lt;li&gt; No minimum work experience required, but with a passion for the beauty industry&lt;/li&gt;&lt;li&gt; Strong interpersonal, leadership, and presentation skills&lt;/li&gt;&lt;li&gt; Digital acumen&lt;/li&gt;&lt;li&gt; Motivated and innovative&lt;/li&gt;&lt;li&gt; Local work permit is required&lt;br&gt;&lt;/li&gt;&lt;/ul&gt;&lt;strong&gt;Job&lt;/strong&gt; Marketing&lt;br&gt;&lt;br&gt;&lt;strong&gt;Primary Location&lt;/strong&gt; Asia Pacific-CN-HK-Yau Tsim Mong&lt;br&gt;&lt;br&gt;&lt;strong&gt;Job Type&lt;/strong&gt; Standard&lt;br&gt;&lt;br&gt;&lt;strong&gt;Schedule&lt;/strong&gt; Full-time&lt;br&gt;&lt;br&gt;&lt;strong&gt;Shift&lt;/strong&gt; 1st (Day) Shift&lt;br&gt;&lt;br&gt;&lt;strong&gt;Job Number&lt;/strong&gt; 2112144"
https://hk.linkedin.com/jobs/view/business-strategist-at-ubs-2783725867?refId=HpRt87Bhlo2CrHkclqZF%2Bg%3D%3D&trackingId=Ccf3E42niDC5hvNYJ8wTaw%3D%3D&position=3&pageNum=0&trk=public_jobs_jserp-result_search-card,2021-11-07T14:35:46.000Z,Business Strategist,,"Banking,Financial Services,Investment Banking",HK,Hong Kong,,,FULL_TIME,UBS,https://ch.linkedin.com/company/ubs,"&lt;strong&gt;Job Reference #&lt;br&gt;&lt;/strong&gt;240741BR&lt;br&gt;&lt;br&gt;&lt;strong&gt;Job Type&lt;br&gt;&lt;/strong&gt;Full Time&lt;br&gt;&lt;br&gt;&lt;strong&gt;Your role&lt;br&gt;&lt;/strong&gt;Are you motivated to work as part of a cross divisional function that will give you a clear insight into the overall top-down strategy and direction of our bank? Do you want to play a key role in defining and implementing that for UBS in APAC? Do you have a clear understanding of a specific business line in either the Investment Bank, Private Bank or Asset Management and how it operates, due to experience either in a similar position or from an external consulting perspective?&lt;br&gt;&lt;br&gt;We are looking for someone to:&lt;br&gt;&lt;br&gt;&lt;ul&gt;&lt;li&gt; Develop and support the implementation of our Group strategy in APAC as well as strategic sub-streams and thematic endeavors across markets and businesses, to maximize UBS cross-divisional opportunities&lt;/li&gt;&lt;li&gt; Contribute to the development of strategy for each of our business lines in APAC in collaboration with respective business strategy teams and senior stakeholders&lt;/li&gt;&lt;li&gt; Identify and analyze key strategic partnership, inorganic and investment opportunities for UBS in APAC&lt;/li&gt;&lt;li&gt; Collaborate effectively with other teams in the Group Strategy Function, as well as Business Leaders, Finance/Controlling, COO and other global management functions on strategic projects and initiatives&lt;br&gt;&lt;br&gt;&lt;/li&gt;&lt;/ul&gt;&lt;strong&gt;Your team&lt;br&gt;&lt;/strong&gt;As part of the APAC Strategy team based in Hong Kong, you will contribute to the development of UBS’s strategic vision and ambition, and partner with the businesses in driving and operationalizing the key strategic initiatives. Utilizing strong strategic skills, industry experience and functional expertise, the team looks beyond standard solutions to develop new insights, mobilize business strategies, drive tangible results, and position our business even stronger.&lt;br&gt;&lt;br&gt;Due to the cross-divisional (Global Wealth Management, Investment Bank, Asset Management) and cross-market (13 jurisdictions in APAC) nature of the team, this role offers wide opportunities for the candidate to learn and experience the diverse businesses and areas across UBS.&lt;br&gt;&lt;br&gt;&lt;strong&gt;Your expertise&lt;br&gt;&lt;br&gt;&lt;/strong&gt;&lt;ul&gt;&lt;li&gt; Minimum 4-5 years of experience in management consulting or with a top tier global firm and/or relevant financial services sector experience, with a sound understanding of how a global universal bank operates&lt;/li&gt;&lt;li&gt; Strategic mindset and understanding of ""C-level"" agenda and issues&lt;/li&gt;&lt;li&gt; Excellent analytical skills and problem-solving capabilities (for conceptual, qualitative and quantitative topics)&lt;/li&gt;&lt;li&gt; Strong communication and presentation skills&lt;/li&gt;&lt;li&gt; High level of proficiency in Microsoft PowerPoint and Excel&lt;br&gt;&lt;br&gt;&lt;/li&gt;&lt;/ul&gt;&lt;strong&gt;About Us&lt;br&gt;&lt;/strong&gt;Expert advice. Wealth management. Investment banking. Asset management. Retail banking in Switzerland. And all the support functions. That's what we do. And we do it for private and institutional clients as well as corporations around the world.&lt;br&gt;&lt;br&gt;We are about 60,000 employees in all major financial centers, in more than 50 countries. Do you want to be one of us?&lt;br&gt;&lt;br&gt;&lt;strong&gt;Join us&lt;br&gt;&lt;/strong&gt;We're a truly global, collaborative and friendly group of people. Having a diverse, inclusive and respectful workplace is important to us. And we support your career development, internal mobility and work-life balance. If this sounds interesting, apply now.&lt;br&gt;&lt;br&gt;&lt;strong&gt;Disclaimer / Policy Statements&lt;br&gt;&lt;/strong&gt;UBS is an Equal Opportunity Employer. We respect and seek to empower each individual and support the diverse cultures, perspectives, skills and experiences within our workforce."
https://hk.linkedin.com/jobs/view/hsbc-global-graduate-programme-2022-hong-kong-singapore-at-hsbc-2775493050?refId=HpRt87Bhlo2CrHkclqZF%2Bg%3D%3D&trackingId=FkRy6C9DsbEC5%2BeNClPEJQ%3D%3D&position=4&pageNum=0&trk=public_jobs_jserp-result_search-card,2021-10-27T08:18:47.000Z,HSBC Global Graduate Programme 2022 - Hong Kong &amp; Singapore,,"Banking,Financial Services,Investment Banking",HK,Hong Kong,,,FULL_TIME,HSBC,https://uk.linkedin.com/company/hsbc,"Applications for our global graduate programmes in Hong Kong and Singapore are now open.&lt;br&gt;&lt;br&gt;You’re excited about starting your career and exploring the many paths and possibilities. We’re a global bank with an inclusive culture and diverse opportunities, spanning all aspects of banking, technology, operations and beyond.&lt;br&gt;&lt;br&gt;Whichever path you choose, we offer valuable experiences and learning, with support at every step.&lt;br&gt;&lt;br&gt;To read more about each graduate programme and to apply, please click on the programmes listed below. To understand our application and the assessment process, or discover more about a graduate career at HSBC, please visit &lt;strong&gt;hsbc.com/earlycareers&lt;br&gt;&lt;br&gt;&lt;/strong&gt;&lt;strong&gt;Hong Kong&lt;br&gt;&lt;br&gt;&lt;/strong&gt;Commercial Banking Graduate Programme&lt;br&gt;&lt;br&gt;Markets &amp;amp; Securities Services – Securities Services Graduate Programme&lt;br&gt;&lt;br&gt;Markets &amp;amp; Securities Services – Markets Graduate Programme&lt;br&gt;&lt;br&gt;Wealth and Personal Banking Graduate Programme&lt;br&gt;&lt;br&gt;Asset Management – Investments Graduate Programme&lt;br&gt;&lt;br&gt;Asset Management – Alternatives Graduate Programme&lt;br&gt;&lt;br&gt;Global Private Banking Graduate Programme&lt;br&gt;&lt;br&gt;Global Operations Graduate Programme&lt;br&gt;&lt;br&gt;Technology Graduate Programme&lt;br&gt;&lt;br&gt;&lt;strong&gt;Singapore&lt;br&gt;&lt;br&gt;&lt;/strong&gt;Global Banking – Investment Banking Graduate Programme&lt;br&gt;&lt;br&gt;Markets &amp;amp; Securities Services – Markets Graduate Programme&lt;br&gt;&lt;br&gt;Final year undergraduate or recent graduate&lt;br&gt;&lt;br&gt;You will have obtained or will be working towards a 3.2/4.0 or 4.0/5.0 cumulative GPA or the equivalent of a 2.1 from a recognised University (as appears on your official University transcript or degree certificate). Be fluent in English, however, for Hong Kong programmes, knowledge of Mandarin and/or Cantonese would be an advantage.&lt;br&gt;&lt;br&gt;For more information on requirements and application deadline, please refer to &lt;strong&gt;hsbc.com/earlycareers&lt;/strong&gt; for details.&lt;br&gt;&lt;br&gt;&lt;strong&gt;Job Field&lt;/strong&gt;: Branch and Retail Banking&lt;br&gt;&lt;br&gt;&lt;strong&gt;Primary Location&lt;/strong&gt;: Asia Pacific-Hong Kong-Hong Kong Island-Central&lt;br&gt;&lt;br&gt;&lt;strong&gt;Schedule&lt;/strong&gt;: Full-time&lt;br&gt;&lt;br&gt;&lt;strong&gt;Job Posting&lt;/strong&gt;: 27-Oct-2021, 14:52:49"
https://hk.linkedin.com/jobs/view/management-trainee-at-adidas-2783702290?refId=HpRt87Bhlo2CrHkclqZF%2Bg%3D%3D&trackingId=EcOG4ITnwOm5O28yk6Akgg%3D%3D&position=5&pageNum=0&trk=public_jobs_jserp-result_search-card,2021-11-05T05:59:43.000Z,Management Trainee,,"Sporting Goods,Manufacturing,Retail",HK,Hong Kong,,,FULL_TIME,adidas,https://de.linkedin.com/company/adidas,"&lt;strong&gt;adidas Hong Kong Management Trainee Program&lt;br&gt;&lt;br&gt;&lt;/strong&gt;is to provide the young talents the platform to grow as individuals and as future employees.&lt;br&gt;&lt;br&gt;In this program, we offer a unique platform to start your career coached by experienced mentors and managers. You will have the opportunity to rotate within 24 months through different functions of business units, including Brand Activation, Project Management, Retail and eCommerce in Hong Kong. You may also have a rotation opportunity in Shanghai, our Greater China Headquarters, in the last 6 months of the program which helps you develop the multi-cultural career.&lt;br&gt;&lt;br&gt;&lt;strong&gt;What are we looking for?&lt;br&gt;&lt;/strong&gt;&lt;ul&gt;&lt;li&gt;University degree (Bachelor/Master) preferably in Business Administration, Marketing or related disciplines with strong academic record&lt;/li&gt;&lt;li&gt;Less than 12 months practical experience&lt;/li&gt;&lt;li&gt;Passion for sports&lt;/li&gt;&lt;li&gt;Good team player&lt;/li&gt;&lt;li&gt;Marketing intelligence to the market&lt;/li&gt;&lt;li&gt;Mobile &amp;amp; international mindset&lt;/li&gt;&lt;li&gt;Creative, collaborative and confident&lt;/li&gt;&lt;li&gt;Excellent communications skills in English and Chinese&lt;/li&gt;&lt;li&gt;Strong in problem-solving and analytical skills&lt;/li&gt;&lt;li&gt;Strong customer focus&lt;br&gt;&lt;/li&gt;&lt;/ul&gt;&lt;strong&gt;This exciting program will start in July 2022!&lt;/strong&gt;"
https://hk.linkedin.com/jobs/view/corporate-banking-associate-at-citi-2779403143?refId=HpRt87Bhlo2CrHkclqZF%2Bg%3D%3D&trackingId=LOMdxH4JhjHMYapCBdjOUQ%3D%3D&position=7&pageNum=0&trk=public_jobs_jserp-result_search-card,2021-11-03T00:00:00.000Z,Corporate Banking Associate,,"Banking,Financial Services,Investment Banking",HK,Hong Kong,,,FULL_TIME,Citi,https://www.linkedin.com/company/citi,"Job Id: 21390442&lt;br&gt;&lt;br&gt;Global Capital Management, as part of BCMA, plays a key role in helping ICG and BCMA management deliver on firms strategic objectives like returns/RoTCE and regulatory/risk management. GCM’s mandate within BCMA is to ensure that all capital commitments to ICG clients are consistent with client relationship strategy, balance sheet and return objectives. The group is responsible for: (i) driving the internal capital approval process which includes aligning relationship stakeholders on client strategy; (ii) planning and implementing the tools, processes and trainings on returns metrics including RoTCE (iii) supporting the client franchise along with Industry to drive critical themes like LIBOR transition and ESG (iv) leading the execution of a variety of BCMA senior management initiatives including Wholesale Credit Review, Concentration Limits, SCO pipeline; and (v) Corporate finance responsibilities for leverage finance portfolio and structuring advisory for complex transactions along with BSCO approvals; vi) being a trusted advisor to Regional Heads, Industry Heads, Risk colleagues at the region and in the country, BCMA heads and bankers in structuring and navigating strategic / BAU transactions.&lt;br&gt;&lt;br&gt;The Vice President role in capital management involves both leadership and team work extensively. The primary responsibilities include assessing and recommending approvals for new extensions of capital to Citi clients and guiding PAM teams on efficient use of capital. Additionally, the role entails working on global strategic projects and initiatives that support management stated goals of improvement in RoTCE for the bank and for business groups. This person works closely with Country Corporate Banking teams, Risk Management and Product partners to aid alignment of client strategy and execution. In addition to ensuring efficient capital management:&lt;br&gt;&lt;ul&gt;&lt;li&gt;Has responsibility for forecasting / monitoring loan growth to ensure the Regional portfolio is managed within the global plan, working closely with the regional Finance team&lt;/li&gt;&lt;li&gt;Arrange training to banking, risk and product teams on capital developments with a particular focus on TCE and Return on TCE&lt;/li&gt;&lt;li&gt;Manages quarterly ""red zone"" approvals&lt;/li&gt;&lt;li&gt;Focus on public and private side risk mitigation and improve velocity of loan book by bringing efficiencies to the process of mitigation&lt;/li&gt;&lt;li&gt;Work on strategic global and regional projects to wallet share, revenues, improvement in returns and client value&lt;/li&gt;&lt;li&gt;Involvement in key projects like LIBOR transition that are transformative for the bank&lt;br&gt;&lt;/li&gt;&lt;/ul&gt;&lt;strong&gt;Key responsibilities: &lt;br&gt;&lt;/strong&gt;&lt;ul&gt;&lt;li&gt;Work with global loan portfolio advisory team to bring more efficiency to risk defeasance and capital optimization (RWA) across the BCMA lending portfolio in Asia&lt;/li&gt;&lt;li&gt;Ensure a consistent approach to modeling transaction returns across the regional team that is aligned with global practices&lt;/li&gt;&lt;li&gt;Support capital approval process for the region with approval coverage for various and differing countries over time&lt;/li&gt;&lt;li&gt;Participate and contribute in the WCR and other remediation projects&lt;/li&gt;&lt;li&gt;Contribute to development of the BCMA Loan product program&lt;/li&gt;&lt;li&gt;Continuously stay informed of best practices and market and industry trends&lt;/li&gt;&lt;li&gt;Appropriately assess risk when business decisions are made, demonstrating particular consideration for the firm's reputation and safeguarding Citigroup, its clients and assets, by driving compliance with applicable laws, rules and regulations, adhering to Policy, applying sound ethical judgment regarding personal behavior, conduct and business practices, and escalating, managing and reporting control issues with transparency.&lt;br&gt;&lt;/li&gt;&lt;/ul&gt;&lt;strong&gt;&lt;u&gt;Qualifications:&lt;br&gt;&lt;/u&gt;&lt;/strong&gt;&lt;ul&gt;&lt;li&gt;Consistently demonstrate clear and concise written and verbal communication&lt;/li&gt;&lt;li&gt;Demonstrated planning, negotiation, organizational and analytical skills&lt;/li&gt;&lt;li&gt;5-8 years of experience, preferably in Corporate Banking Or Product Or Client facing role&lt;/li&gt;&lt;li&gt;Bachelors Degree, Good to have Masters in Business&lt;/li&gt;&lt;li&gt;Related lending/credit experience or equivalent product experience&lt;/li&gt;&lt;li&gt;Demonstrated credit skills, background in credit or first line will be helpful&lt;/li&gt;&lt;li&gt;Understanding of capital markets products, derivatives, credit, cash management, trade, finance and securities products preferred&lt;/li&gt;&lt;li&gt;Knowledge of Corporate Banking business including related products, pertinent regulations and the lending and credit approval process&lt;br&gt;&lt;/li&gt;&lt;/ul&gt;-------------------------------------------------&lt;br&gt;&lt;br&gt;&lt;strong&gt;Job Family Group: &lt;br&gt;&lt;br&gt;&lt;/strong&gt;Institutional Banking&lt;br&gt;&lt;br&gt;-------------------------------------------------&lt;br&gt;&lt;br&gt;&lt;strong&gt;Job Family:&lt;br&gt;&lt;br&gt;&lt;/strong&gt;Corporate Banking&lt;br&gt;&lt;br&gt;------------------------------------------------------&lt;br&gt;&lt;br&gt;&lt;strong&gt;Time Type:&lt;br&gt;&lt;br&gt;&lt;/strong&gt;------------------------------------------------------&lt;br&gt;&lt;br&gt;Citi is an equal opportunity and affirmative action employer.&lt;br&gt;&lt;br&gt;Qualified applicants will receive consideration without regard to their race, color, religion, sex, sexual orientation, gender identity, national origin, disability, or status as a protected veteran.&lt;br&gt;&lt;br&gt;Citigroup Inc. and its subsidiaries (""Citi”) invite all qualified interested applicants to apply for career opportunities. If you are a person with a disability and need a reasonable accommodation to use our search tools and/or apply for a career opportunity review &lt;strong&gt;Accessibility at Citi&lt;/strong&gt;.&lt;br&gt;&lt;br&gt;View the ""&lt;strong&gt;EEO is the Law&lt;/strong&gt;"" poster. View the &lt;strong&gt;EEO is the Law Supplement&lt;/strong&gt;.&lt;br&gt;&lt;br&gt;View the &lt;strong&gt;EEO Policy Statement&lt;/strong&gt;.&lt;br&gt;&lt;br&gt;View the &lt;strong&gt;Pay Transparency Posting&lt;/strong&gt;"
